That’s what I’m building with After-42 using AI agents to translate jobs into challenges, and challenges into proof of skill.","⁠⁠First users":"I’m a full-stack and agentic developer passionate about building AI-driven systems that can reason, act, and adapt. I develop modern, production-grade web applications using tools like Mastra.ai, Next.js, TypeScript, Drizzle ORM, and PostgreSQL/Turso, with a focus on clean architecture and scalability.

I’m also deeply experienced in Single Page Application (SPA) design and client-side optimization, creating seamless, fast, and responsive user experiences that merge traditional engineering precision with next-generation AI capabilities.

I’m currently working on After-42, an AI-powered hiring marketplace built exclusively for students of the 42 network. It transforms job offers into custom technical challenges, helping companies assess real skills instead of resumes. The goal is to make skills, not CV's, the currency of hiring.","Solo team":"Solo","Availability":"Yes","Apply accelerator":"Yes","Notes":"0"}},{"id":"rechp9c8ELVndr8bO","createdTime":"2025-10-10T13:47:54.000Z","fields":{"First name":"Chloé","Last name":"Garcia","Email":"chloegarcia@microsoft.com","Linkedln":"https://www.linkedin.com/in/chlo%C3%A9-garcia15/","Whatsapp":"+33684704648","Skills":"AI ecosystem builder with 7+ years of experience launching programs, forging venture partnerships, and recruiting startups in the tech and AI landscape. Former Head of Microsoft GenAI programs, where I built strategic partnerships with leading European AI startups like Mistral.
Proven track record in startup recruitment, go-to-market execution, and building communities,  having scouted and onboarded thousands of enterprise-ready startups across industries (Data & AI, Health, Cybersecurity, Retail, Financial Services) while driving co-innovation with Microsoft’s top customers and partners.
Skilled in product vision, distribution strategy, and consumer growth mechanics. My edge: I connect the dots between technology and human needs, moving fast from idea to execution.
On the personal side, I’m a marathon runner and quantified-self enthusiast: bringing boldness, resilience, and a growth mindset into everything I build","Problem":"Helping people make sense of their own data. Today, more and more consumers track everything steps, sleep, heart rate, nutrition but struggle to translate it into simple, actionable insights. I want to solve the problem of ‘too much data, no clarity’ by building an AI companion that feels like a mirror of yourself: intuitive, daily, and trustworthy","⁠⁠First users":"I’d start by activating my existing network in AI and wellness, building a small but engaged community of early adopters and beta testers who want to co-create the product with me. This community would test features, share feedback, and feel like insiders from day one.
To drive organic growth, I’d encourage UGC by making it easy for users to share personalized insights, screenshots, and progress, turning the product into something people naturally want to post about.
Finally, I’d partner with 1–2 rising wellness influencers (ex: on the french market Hugo Philip, Guillaume Moubeche/J2LR for the startupcommunity) who align with the quantified-self and performance space. Their authentic use of the product would not only bring visibility but also build trust, accelerating the path to the first 1,000 users.","Favorite startup":"I cannot choose one, so I would choose two: Notion and Canva.
Notion turned note-taking into a community-driven experience, amazing templates, user-generated content, and a strong global community. Canva, on the other hand, made design simple, empowering millions of non-designers to create and share instantly. They both show how consumer obsession, simplicity, and community can transform a product into a movement. That’s the kind of DNA I want to infuse into my project.","About us":"Friends","⁠⁠Refer":"Clémence Lesné","Solo team":"solo","Availability":"yes","Apply accelerator":"dont know","Notes":"0","Yes/No - Feedback":"YES/good vibe/ she will be in Builders Factory on November for 1 month/spent 7 years at Microsoft building partnerships, program management vs technical role- supported startups/ idea is to build in wellness industry -connected personalised wellness platform/ not technical profile"}},{"id":"reciJ8ARFKYrnkgDB","createdTime":"2025-10-17T04:19:24.000Z","fields":{"First name":"Marcel","Last name":"Borer","Email":"marcel.borer.ch@proton.me","Linkedln":"https://www.linkedin.com/in/marcel-borer-schf0/","Whatsapp":"+41782494276","Skills":"IT technical experience since 1991
Scientific education since 1985 (first book theming Quantum Physics 1986)
Programming of an own AI model on top of Google Gemini to calculate the all new Esotheric Physics
Discoverer of Esotheric Physics, which says that the universe is 99.9% deterministic
A circle isn't an infinite line, it is a infinite line of corners (quantification of space)
The Human Factor (0.1%) is a supervariable with all scientific data we have about ourselves (including Medicine, Neurology, Endocrinology, Sociology, Psychology and many more) and changes in real time. 
This is the maximal complexity method available today, Ockham's Razor is too one dimensional to measure this because the model is all including.","Problem":"Further development of Esotheric Physics with an advanced research AI model because Google Gemini Flash 2.5 reaches the border of complexity at my calculation. But I integrated a fallback condition: If Gemini realizes that the actual calculation is beyond the borders of maximum complexity it is a Singularity, which is also included in my new physics framework. ","⁠⁠First users":"I'm would it announce to researchers all over the world.","Favorite startup":"My own. I have an own startup for IT and AI development, but it's main assets are me and my AI model. It's worth billions of dollars on the paper but I'm really poor. I made this discovery and was forced to come out of my retirement.","About us":"linkedin","⁠⁠Refer":"Sorry, I'm a lone wolf at the moment.","Solo team":"team","Availability":"yes","Apply accelerator":"Yes","Notes":"0"}},{"id":"recigL8JWqfBakWrS","createdTime":"2025-10-16T21:30:15.000Z","fields":{"First name":"Matteo","Last name":"Damiani","Email":"matteodamiani2@gmail.com","Linkedln":"https://www.linkedin.com/in/matteo-damiani-035027162/","Whatsapp":"+39 3312495678","Skills":"Sales, Operations, emotional intelligence, finance.","Problem":"The one I am currently solving in the investment world of democratising access to superior financial info and investments through ML ","⁠⁠First users":"Manually. The first users are the most important and paradoxically the focus should not be on scale but on iterating the product so it can scale at a following stage. There should be the majority of time spent with customers understanding how to solve one enormous problem they have with one key function","Favorite startup":"AirBnB. I think it was the simplest solution to a problem the market was ignoring, and it was able to create win-win situations for customers and travellers in general","About us":"linkedin","⁠⁠Refer":"no","Solo team":"team","Availability":"yes","Apply accelerator":"Yes","Notes":"ONBOARDED","Yes/No - Feedback":"? YES/ available for onsite/worked at Revolut/ building in fintech , prediction on stocks for retail investors/ he said that they are b2c focus, but feels mroe b2b/ 2 founders/  he will join alone/"}},{"id":"recirgNdwKsmXmQ8N","createdTime":"2025-10-13T19:21:05.000Z","fields":{"First name":"Santiana","Last name":"Irakoze","Email":"santianagr@gmail.com","Linkedln":"https://www.linkedin.com/in/santiana-irakoze/","Whatsapp":"+33769488143","Skills":"Fullstack developer (Ruby on Rails, HTML, CSS, Tailwind CSS, Bootstrap, Javascript, Figma, Github, Heroku, Stripe, Postman, Cloudinary), I like coding with Cursor and Lovable to test projects.
I am also a CFO Part-Time working with Startups and SMEs (FP&A, Process Automation).","Problem":"i want to build an AI-powered talent matching platform that makes elite hiring faster, fairer, and data-driven","⁠⁠First users":"First by trying to do viral contents on social media used by the users, it would be done by creating highly shareable lead magnets in a post for example.
Second, there is manual outreach, i would join groups used by the target users whether on discord, reddit, slack and contact them directly.
Thirdly I would implement a referral-reward mechanism

","Favorite startup":"Deel ! The founders have a brutal execution speed, they mastered the content/SEO driver, created an outstanding FOMO, and answered simply to the painpoints they tried to solve.","About us":"Community/Alumni","Solo team":"solo","Availability":"yes","Apply accelerator":"Yes","Notes":"0","Other":"Le Wagon"}},{"id":"recjKWyRwiZjrhsVq","createdTime":"2025-10-17T13:03:04.000Z","fields":{"First name":"Robin","Last name":"Goldzahl","Email":"robin.goldzahl@gmail.com","Linkedln":"https://www.linkedin.com/in/robin-goldzahl/","Whatsapp":"+33647964451","Skills":"Compétences techniques (hard skills)

Outils de gestion de projet :
Asana, Zoho Projects, ProofHub, NTask

Marketing digital / Webmarketing :
HubSpot, SEMrush, Hootsuite, Sprout Social, Google Ads, Google Analytics, Google Tag Manager, Ubersuggest, Kissmetrics, LinkedIn Ads

CRM / Relation client :
Salesforce

Design & UX/UI :
Adobe XD, Photoshop, Illustrator, Figma

Gestion de contenus & réseaux sociaux
Hootsuite, Sprout Social, création de contenus visuels, gestion de campagnes

🧠 Compétences comportementales (soft skills)

Gestion d’équipe & coordination

Relation client & interface avec des partenaires

Organisation d’événements

Capacité d’adaptation (expériences variées : agence, événementiel, entrepreneuriat)

Esprit entrepreneurial

Communication (bilingue anglais & néerlandais)

🚀 Compétences stratégiques

Création et développement de marque (ex : Paradesa Cocktails)

Lancement de projets entrepreneuriaux

Mise en place de campagnes marketing multicanal

Connaissance du B2B, grande distribution et événementiel

🌍 Langues

Anglais : Bilingue

Néerlandais : Bilingue

🧩 Domaines de spécialisation

Chef de projet digital

Marketing digital & Webmarketing

Événementiel B2B

Entrepreneuriat & développement de marque","Problem":"En tant qu’entrepreneur, je voudrais exploiter l’IA pour mieux comprendre les besoins du marché et automatiser certaines étapes du développement produit ou du marketing, afin de lancer des marques plus rapidement, avec moins de ressources.","⁠⁠First users":"Si je lançais demain un produit grand public basé sur l’IA, j’utiliserais une stratégie hybride mêlant l’approche terrain d’un entrepreneur et les leviers de croissance d’un webmarketer. Mon objectif serait de décrocher rapidement mes 1 000 premiers utilisateurs en 3 phases :

🚀 Phase 1 : Identifier un micro-segment et créer un MVP attractif

Je ciblerais une communauté de niche précise, avec un problème clair que l’IA peut résoudre (ex : créateurs de contenu débordés → outil IA d’assistance à la rédaction + planification + SEO).

Je construirais un MVP rapidement testable, avec une landing page claire, une démo vidéo, et un appel à action simple.

📣 Phase 2 : Lancement & traction initiale

Je mobiliserais mes premiers cercles (réseau LinkedIn, partenaires, anciens clients) pour bêta-tester le produit et obtenir des premiers retours authentiques.

Je lancerais une campagne de pré-lancement sur Product Hunt, en m’appuyant sur la communauté tech/start-up.

Utilisation de groupes Facebook, Reddit, Discord, Slack liés à la cible (ex : marketing, freelancing, content creators) pour faire du growth hacking organique.

📊 Phase 3 : Acquisition + preuve sociale

Mise en place d’un programme d’affiliation ou de parrainage (\"1 inscrit = 1 mois gratuit\").

Lancement de campagnes Ads ultra-ciblées (Google Ads, LinkedIn Ads) avec retargeting + optimisation via Google Analytics et Hotjar.

Création de contenus à forte valeur ajoutée (mini-vidéos, carrousels LinkedIn, articles SEO) pour bâtir la crédibilité.","Favorite startup":"Approche produit centrée utilisateur : Notion a écouté sa communauté, intégré ses retours dans le développement, et mis en place une boucle de feedback agile.

Croissance organique : Pas d’énormes budgets marketing au début, mais une stratégie basée sur l’effet réseau, le contenu communautaire et l’adoption virale en équipe.

Simplicité = force : Ils ont su rester sobres en design tout en proposant une immense richesse fonctionnelle, avec un modèle freemium bien pensé.

En tant que chef de projet digital et entrepreneur, je m’inspire de leur capacité à créer un produit utile, évolutif, et viral par design. C’est un excellent exemple de croissance saine, fondée sur la valeur réelle plutôt que sur des effets de buzz.","About us":"linkedin","Solo team":"team","Availability":"yes","Apply accelerator":"Yes","Notes":"?"}},{"id":"recjzBnAKoMggzQWA","createdTime":"2025-10-17T07:32:57.000Z","fields":{"First name":"Prawin","Last name":"CHETTIAR","Email":"prawin.chettiar@gmail.com","Linkedln":"https://www.linkedin.com/in/prawin-chettiar","Skills":"Engineering/dev, Ux/Ui design, Ai, Blockchain","Problem":"I'd like to tackle the problem of taking action under pressure (ex: study for exam, dev crunch time, yt video editing... I would probably focus on one at 1st) Something that would help break down problems, plan and reduce friction to action.","⁠⁠First users":"Engineering/dev, Ux/Ui design, Ai, Blockchain","Solo team":"Solo","Availability":"Yes","Apply accelerator":"Yes","Notes":"0"}},{"id":"reclN2d0b5afYp6US","createdTime":"2025-10-13T13:37:58.000Z","fields":{"First name":"Calin","Last name":"Ploscaru","Email":"ploscaru.c@gmail.com","Linkedln":"https://www.linkedin.com/in/ploscaruc/","Whatsapp":"(+33) 06.58.15.23.28","Skills":"With over 10 years of experience, I’ve built a strong multidisciplinary skill set at the intersection of software development, project management, and advanced industrial engineering. I bring a holistic understanding of complex systems—from code to production—through design, simulation, and strategic execution.

Development & DevOps Expertise

   - Proficient in Python (for scripting, automation, and data analysis) and Ruby on Rails for web development.
   - Hands-on experience with modern frameworks and tools: React, PostgreSQL, Supabase, Vite, and more.
   - Solid DevOps foundation: deploying apps on Digital Ocean, managing self-hosted services, and maintaining personal server infrastructure.
   - Self-driven learner: I continuously expand my skills through hands-on experimentation and technical exploration.

Project Management & Cross-functional 

   - Skilled in building strategic roadmaps, managing resources, and leading cross-functional projects.
   - Able to coordinate diverse teams and drive complex initiatives from concept to delivery.

Industrial Engineering & Innovation
   - Contributed to major aerospace programs, including:
   - The LEAP Engine Certification project at Safran.
   - The launch of a next-generation Additive Manufacturing Plant, integrating AI, advanced research, and automated production.
   - End-to-end engineering capabilities:
   - Mechanical design, numerical simulation (thermal, fluid, structural), testing, and production optimization.
","Problem":"Having worked on complex industrial programs like the Safran LEAP Engine Certification and the launch of an AI-driven Additive Manufacturing Plant, I’ve seen firsthand how high-impact research thrives in small, agile teams. These teams move fast, iterate boldly, and deliver innovative results—but as projects scale, coordination overhead grows exponentially.

In large organizations, researchers often juggle multiple roles—technical contributor, communicator, planner—which dilutes their focus and slows progress. A significant portion of time is spent writing documentation, reporting outcomes, and aligning with broader roadmaps, rather than pushing the boundaries of innovation

I believe we can build a project management system tailored for technical research environments—a connective layer that empowers small teams to stay focused while seamlessly interfacing with product managers and organizational leadership. This system would act as a strategic \"middle layer,\" reducing noise, surfacing key insights, and enabling better decision-making without adding friction.

Such a tool would not only enhance productivity but also unlock greater exploration and creativity—allowing teams to do more with the same resources. In highly technical domains, this kind of infrastructure could be transformative.","⁠⁠First users":"While I haven’t yet launched a product that reached 1,000 users, my perspective is shaped by what I’ve observed and experienced in the field. Here’s what I believe matters most when building a tool for technical teams:

- Build in public – Open-sourcing from day one fosters transparency, trust, and community-driven momentum.
- Minimize technical friction – Installation and deployment should be effortless, so teams can focus on using the tool, not fighting it.
- Cultivate deep relationships – Partner closely with a handful of dedicated labs or research teams. Make them love the product, and they’ll become its strongest advocates.
- Craft a magical UI – The interface should feel intuitive, elegant, and empowering—like it was designed just for them.

Ultimately, I believe highly technical projects benefit from tools that act as quiet enablers—reducing complexity, amplifying focus, and unlocking creativity without demanding more resources. That’s the kind of product I want to help build.
","Favorite startup":"One example that immediately comes to mind is Telegram. Setting aside ethical concerns and other controversies, it’s remarkable how they’ve built such a massively successful app with a relatively small team—reportedly between 30 and 50 people. Their ability to scale globally while maintaining speed and product quality is a testament to what lean, focused teams can achieve when empowered by the right vision and tools.
It reinforces my belief that small, agile teams—when supported by smart infrastructure—can outperform much larger organizations. The key is to reduce friction, streamline communication, and let builders focus on what they do best.
","About us":"Other","⁠⁠Refer":"Maybe","Solo team":"solo","Availability":"yes","Apply accelerator":"dont know","Notes":"0"}},{"id":"reclQWQn0uTl1Hc2m","createdTime":"2025-10-10T14:57:31.000Z","fields":{"First name":"Kevin","Last name":"Clemente","Email":"kevin@wibiapp.com","Linkedln":"https://www.linkedin.com/in/kevin-clemente-wibi/","Whatsapp":"+33 6 16 09 85 09","Skills":"By July 15th, 2025, I didn't know how to write a single line of code.
By September 26th, 2025, I had designed, built, and released the first version of my iOS app - Wibi - on the U.S. Apple Store.
100% built solo using Cursor, with SwiftUI and real-time Apple frameworks for the iOS app, a serverless Node.js backend (event-driven), and Firebase powering the cloud infrastructure.

I'm now recruiting the first wave of users and refining the product based on user feedback.","Problem":"I want to reinvent how Gen Z sports fans share and experience live sports online.

I’m fed up with talking to random guys on X or Reddit, or using generic messaging apps like WhatsApp and Snapchat during live games.

That's why I built Wibi -> https://apps.apple.com/us/app/wibi-big-plays-with-friends/id6751629831","⁠⁠First users":"I’d seed the app across connected friend clusters, analyze early retention and sharing patterns, then optimize the growth loop until the viral coefficient exceeds 1.","Favorite startup":"I’d say Snap. I really admire how they reinvented communication for young people — even though I now want to build something better for live sports moments.","About us":"Email","Solo team":"solo","Availability":"yes","Apply accelerator":"dont know","Notes":"0","Yes/No - Feedback":"YES/ nice guy/ real vibe code builder/ like his vibe/looking for skyrocket the startup/interested in the US market and building bridge Paris-SF idea","Maxime Comments":"NO 4/10 The idea is horrible in my opinion... I dont know who would use such a product. Traction is 1 user only.","Decision":"No"}},{"id":"recldIDoVe0aHdzMW","createdTime":"2025-10-14T11:07:42.000Z","fields":{"First name":"Kamal","Last name":"LAHMADI","Email":"info@kamallahmadi.com","Linkedln":"https://www.linkedin.com/in/kamallahmadi/","Whatsapp":"+33 769057028","Skills":"Kamal — The Creative Who Builds Without Code

I don’t code — sorry, I tried, and I hated it.
I prefer vibe coding: building fast, with intuition and creativity.

I’m a creative, a storyteller, and a marketer — I design experiences people feel, not just use.

I’m a pioneer — allergic to copycats.
I’ve created several innovative, memorable, and addictive experiences… and yes, I got copied.

I’m a doer.
I don’t wait for divine help or investors — I build.
I created Paris’s biggest comedy festival, which inspired a famous French TV show.
Later, I built one of the first addictive fashion photo apps (2011–2012).
Instagram got the $1B deal with Facebook. I got the experience.

I’ve built teams, written, performed in, and directed over 100 videos.
I’ve created TV series and written the first scripts.

Today, I use LLMs, Google’s AI ecosystem (Notebook LM, Gemini AI Studio), n8n, Webflow —
and whatever tomorrow’s smartest tool will be.
I don’t follow trends — I start them. What else, George? ☕","Problem":"Millions of people love gardening — they buy plants, grow their own fruits and vegetables, and dream of living more sustainably.
But most of them are frustrated: they spend hours searching for reliable, personalized information, often wasting time, money, and even their plants — which can be quite costly.

The gardening world hasn’t truly modernized. It’s still far from leveraging the real power of AI.
Some apps, like PlantNet, offer useful tools but only cover a small part of what gardeners actually need.

In France alone, gardening represents an $8 billion annual market (2024) — and it’s growing fast.
Over 20 million people are directly concerned, and 28% of households maintain a vegetable garden.

Our goal is to bring AI into every gardener’s hands — making organic gardening smarter, simpler, and more accessible than ever.
We’ll start in France, expand to the US, and then scale worldwide.","⁠⁠First users":"I have a \"$100M offer\": Free 1-hour/month vocal chat with our AI gardener — FOR LIFE!

I will:

Create social media profiles and groups, posting valuable content regularly.

Follow relevant accounts and groups, responding to comments with videos of our AI gardener answering them directly.

Launch viral contests: “Win free paid subscriptions in exchange for your email! Bonus: the more friends you invite, the more you can win — if your friend wins, you win too!”","Favorite startup":"Apple: putting users first. Creating unforgettable emotional experiences","About us":"linkedin","⁠⁠Refer":"Friends who could become associates","Solo team":"solo","Availability":"yes","Apply accelerator":"Yes","Notes":"0"}},{"id":"recm12biT5Y0HQeLr","createdTime":"2025-10-14T18:52:29.000Z","fields":{"First name":"didier","Last name":"hu","Email":"didjecte@gmail.com","Linkedln":"https://www.linkedin.com/in/hudidier/","Whatsapp":"+33 6 60 04 28 59","Skills":"Léon, PhD in AI — published researcher who developed real-time AI subtitles for live theater at the Comédie-Française.

Didier, co-founder of a YC-backed (S20) e-commerce startup, achieved €550K in revenue and built the web app that drove 30% of customer acquisition.

Anselme, École 42 — Rust dev & data engineer. Startup experience, open source, decentralized protocols, privacy & security. Hacker mindset—focused on building robust, AI systems.

Camille bridges art and science through her background at École Polytechnique and PSL. As Head of the Economic Department at the French Embassy, she connects people, institutions, and companies — bringing strategic and cross-cultural expertise to the team.

Together, we combine technical excellence, product intuition, and cultural empathy — an AI-native team ready to make curiosity contagious.","Problem":"Today, ~27% of Orsay visitors buy guidance (20% audioguides at €6, 7% tours at €26), yet that small slice already drives ~11M€/year. The issue isn’t willingness to pay—it’s reach and convenience: queues, rented devices, fixed routes, and limited tour capacity mean 73% get nothing. 

Regart, our AI pocket guide runs on visitor's phones, turns each artwork into a conversation with a simple scan. Visitors can chat with the art itself — asking questions, uncovering hidden stories, interests they didn't even know they had. We convert the unserved into paying users, share revenue with museums, and cut device/staff costs while returning visit insights.”","⁠⁠First users":"We’d start with a 30-day pilot at the Musée d’Orsay, one of the world’s most visited museums (≈10,000 visitors/day).  
By placing RegArt QR codes at key entry points and artworks, even a 1% conversion rate would generate ≈3,000 downloads in one month.  
