Having lived in Canada, France, and Turkey, I’ve developed a strong appreciation for multicultural collaboration and user-centered innovation. I’m currently based in Paris, where I’m focused on launching my startup, leveraging AI and automation to build technology that solves real-world problems across markets. I believe impactful ventures are built at the intersection of technical excellence and human empathy — and that’s the philosophy driving my work.","Problem":"I’m passionate about using AI to empower small and local businesses, a sector that’s often overlooked because it doesn’t seem “high-tech” on the surface. Yet these merchants form the backbone of many economies, and most still operate with minimal digital tools. I see a huge opportunity to bring accessible automation, AI, and simple backend solutions to help them modernize without complexity. My goal is to build tools that are intuitive, multilingual, and designed around their real workflows, rather than repurposed from enterprise software. Helping these businesses go digital isn’t just impactful — it’s an open frontier where thoughtful innovation can create outsized value.","⁠⁠First users":"I’d start by focusing on a niche community with a clear, underserved pain point and build genuine relationships there. For example, if I were launching an AI tool for small sellers or local merchants, I’d begin by partnering with Instagram shop owners, antique stores, and art sellers — communities where I already have insight and early adopters are easy to identify. I’d offer early access in exchange for feedback, co-create features with them, and use their success stories to build social proof. From there, I’d focus on organic growth through community referrals, targeted content, and collaborations with micro-influencers in the space. The goal wouldn’t just be to get 1,000 signups, but to create 1,000 engaged users who feel the product was built for them.","Favorite startup":"My favorite consumer startup success story is Mistral AI. It’s a powerful example of how Europe can produce world-class technology companies that compete globally. Mistral’s rise proves that the European tech ecosystem has the talent and ambition to build transformative AI products. Seeing this success motivates me to build something from Paris and to contribute to this new wave of European innovation, showing that globally impactful startups can emerge from here too.","About us":"linkedin","Solo team":"solo","Availability":"yes","Apply accelerator":"Yes","Notes":"0"}},{"id":"rec9pouwST51w5x2U","createdTime":"2025-10-17T07:32:57.000Z","fields":{"First name":"Yashu","Last name":"Huang","Email":"yashu.huang@hec.edu","Linkedln":"www.linkedin.com/in/yashu-huang-396506384","Skills":"Product strategy · Financial modeling · Sustainability innovation · User-centric problem solving · Entrepreneurial execution","Problem":"I want to solve the inefficiency and carbon waste of urban last-mile delivery by building an AI platform that integrates public transportation networks with logistics systems. My idea, SmartMove, uses real-time transit data and AI optimization to route parcels through metro, tram, and bus systems — enabling half-day, low-carbon delivery in cities like Paris. The goal is to combine efficiency and sustainability in a localised, human-centered way.","⁠⁠First users":"Product strategy · Financial modeling · Sustainability innovation · User-centric problem solving · Entrepreneurial execution","Solo team":"Solo","Availability":"Yes","Apply accelerator":"What is Pioneers Accelerator? I need more info","Notes":"0"}},{"id":"recAfFsXyu7WhqoLR","createdTime":"2025-10-17T07:32:57.000Z","fields":{"First name":"Romain ","Last name":"Farel","Email":"romain@zenartisan.fr","Linkedln":"https://fr.linkedin.com/in/romain-farel-86219144","Skills":"Data IA Product, Agentic, Voice","Problem":"AI assistant for home renovation","⁠⁠First users":"Data IA Product, Agentic, Voice","Solo team":"Solo","Availability":"Yes","Apply accelerator":"Yes","Notes":"0"}},{"id":"recBNInZp5PRzKCyf","createdTime":"2025-10-10T11:06:43.000Z","fields":{"First name":"BASIL","Last name":"ALBA","Email":"balbader@pm.me","Linkedln":"https://www.linkedin.com/in/basilalba/","Whatsapp":"+33 6 10 59 01 87","Skills":"I’m a full-stack and agentic developer passionate about building AI-driven systems that can reason, act, and adapt. My work combines software engineering, prompt engineering, and agentic development to design intelligent applications powered by autonomous workflows and large language models.
On the technical side, I develop modern, production-grade web applications using tools like Mastra.ai, Next.js, TypeScript, Drizzle ORM, and PostgreSQL/Turso, with a focus on clean architecture and scalability.
I’m also experienced in Single Page Application (SPA) design and client-side optimization, creating seamless, fast, and responsive user experiences that merge traditional engineering precision with next-generation AI capabilities.","Problem":"I’m currently working on After-42, an AI-powered hiring marketplace built for students and alumni of the 42 network. It transforms job posts into custom technical challenges, helping and accompanying non technical HR teams discover and hire the best programmers from the 42 network. The goal is to make skills, not CVs the currency of hiring, bridge the gap between HR departments and technical teams in small and mid level sized companies to improve and optimize the entire tech engineer recruitment process.","⁠⁠First users":". To get the first 1,000 users for After-42, being a 42 student my self,  I’d activate the existing 42 ecosystem, more than 50 campuses and hundreds of partner companies.
. On the student side, I’d collaborate with campus coordinators and student associations to host AI-powered challenge weeks, where real job offers are turned into technical challenges students can complete and showcase. This builds excitement, recognition, and visibility within the network.
. On the company side, I’d reach out to 42’s existing hiring partners, offering a simple on boarding flow that converts their job offers into AI-generated challenges — replacing CVs with proof of skill.
. Each challenge naturally drives vitality: students share their results publicly, companies showcase their talent pipeline, and both sides reinforce each other’s engagement.
In short, I’d grow After-42 by activating a network that already exists — uniting 42 students and their partner companies through transparent, skill-based hiring powered by AI.","Favorite startup":"My favorite consumer startup success story is Notion.
Notion succeeded not by being first, but by redefining how people think about productivity and creation. It turned what could have been “just another notes app” into a movement,giving users the tools to build their own systems instead of forcing them into someone else’s workflow. That shift from product to platform to ecosystem is what made it special.
I love how Notion blended simplicity and depth, intuitive enough for individuals, yet powerful enough for teams to build mini-apps without code. It also grew through community-driven adoption, not advertising: templates, tutorials, and word-of-mouth made every user part of the product’s marketing loop.
That philosophy deeply inspires After-42, a platform where students and companies co-create value. Like Notion, I want After-42 to empower people to build, share, and prove their skills, not just consume a product, but shape it.","About us":"linkedin","Solo team":"solo","Availability":"yes","Apply accelerator":"Yes","Notes":"ONBOARDED","Yes/No - Feedback":"YES/ very passionate about building with AI/ strong tech profile/ open for consumers app to build/ submitted idea was b2b idea for help HR's to hire engineers, but open to switch/ nice vibe in general","Maxime Comments":"6/10 Good drive but no knowledge of the consumer space and is quite junior in tech (just finished 42)
","Decision":"Yes"}},{"id":"recCC5V1TVjgjjhmu","createdTime":"2025-10-17T11:57:53.000Z","fields":{"First name":"Eshetu","Last name":"Feleke","Email":"eshetu_feleke@berkeley.edu","Linkedln":"https://www.linkedin.com/in/eshetu-d-feleke-7b5b3436/","Whatsapp":"+33769588876","Skills":"Product management, 3D modeling, user experience design, architectural design, project management, AI implementation, AI engineering, usability testing, product design, stakeholder management, front-end development, feature prioritization, task automation.","Problem":"I'm developing innovative ways to close the gap between small businesses and their customers with AI technology. Traditionally, after a customer makes a purchase, there’s minimal ongoing interaction until their next visit. My goal is to use AI to nurture a continuous relationship, transforming how businesses connect with their customers.

I'm building a consumer loyalty management platform that integrates with Telegram, WhatsApp, and social media. Customers receive rewards, discounts, and benefits based on their loyalty tier, while businesses gain direct access to their audience, allowing them to share updates and special offers. The system is powered end-to-end by AI and automation. For example, customers can upload purchase receipts each time they shop, earning points that can be redeemed for rewards or discounts. Businesses can identify their most loyal customers and effortlessly track spending habits.

You can see a working MVP demo here: www.loyal-et.vercel.app.","⁠⁠First users":"Depending on where the target users are, its possible to gain first 1000 users from social media (TikTok, LinkedIn, Instagram..possible partnering with relevant content creators) or other sites like Producthunt, AppSumo, HackerNews.","Favorite startup":"I love what ChatGPT has done in the last couple of years. It made AI accessible to the masses, when before, AI seemed very foreign to most people and mainly belonged in scientific or academic realms. Now, thanks to ChatGPT, everyone can use advanced AI for practical needs and creativity. I really admire how it has closed that gap and changed the perception of AI, making it intuitive, useful, and part of everyday life for so many people.","About us":"Friends","⁠⁠Refer":"Friends and cofounder who went to 42.","Solo team":"team","Availability":"yes","Apply accelerator":"Yes","Notes":"0"}},{"id":"recD5yyBqdJPOBN5B","createdTime":"2025-10-17T07:32:57.000Z","fields":{"First name":"Naveen","Last name":"Velmurugan","Email":"naveen.velmurugan@virgildynamics.com","Linkedln":"https://www.linkedin.com/in/naveenvelmurugan/","Skills":"- R&D and business skillsets related to drilling domain (currently focused on geothermal energy).
- Drilling engineer by training, system engineering PhD and was a project manager  for European research project (steered it to top 5 finalist of European geothermal innovation award).
- Hands-on with Python, Matlab and building digital twins.
- Won an award at a geology related AI hackathon in June 2025. ","Problem":"Energy exploration sector (oil, gas, geothermal, CCUS, hydrogen, etc.) have siloed approach between the participating domains like drilling, reservoir and production engineering. However, an interactive, interdependent, and transparent approach is necessary to reduce risks and increasing operational efficiency and production lifetime. This can be accomplished by using Agentic AI framework that is orchestrated by a domain specific LLM for planning and decision making workflows.

This framework can be extended to any other domain that must communicate with multiple digital twins or expertises for a cohesive decision making process. Nevertheless, I'm not married to this idea and rather use it as a starting point and pivot if and when necessary during the sprint. ","⁠⁠First users":"- R&D and business skillsets related to drilling domain (currently focused on geothermal energy).
- Drilling engineer by training, system engineering PhD and was a project manager  for European research project (steered it to top 5 finalist of European geothermal innovation award).
- Hands-on with Python, Matlab and building digital twins.
- Won an award at a geology related AI hackathon in June 2025. ","Solo team":"Solo","Availability":"Yes","Apply accelerator":"Yes","Notes":"0"}},{"id":"recDG5DBz0n7LAEOc","createdTime":"2025-10-14T21:44:11.000Z","fields":{"First name":"Liushifeng","Last name":"Chen","Email":"sfsy1@yahoo.com","Linkedln":"https://www.linkedin.com/in/liushifeng-c/","Whatsapp":"+6596776650","Skills":"I have experience in developing computer vision and machine learning products for dental diagnostics, real estate pricing, and autonomous driving. ","Problem":"I want to build a dental health software that gives personalized advice and reminders for good oral hygiene, based on individual dental records and other data such as diet, brushing habits, photos.","⁠⁠First users":"Cold email dental clinics to offer this as a free product to their patients. Clinics can get better patient trust and retention that translates to long term revenue.","Favorite startup":"Too good to go. It's helping with the problem of food waste while creating a unique experience for consumers (exploring new restaurants and getting a surprise every time).","About us":"linkedin","Solo team":"solo","Availability":"yes","Apply accelerator":"what is","Notes":"0","Yes/No - Feedback":"need visa/ he is from the US/ but good candiate"}},{"id":"recEVuTHOp6VFD4tB","createdTime":"2025-10-24T00:22:12.000Z","fields":{"First name":"Chirag","Last name":"Kankrecha","Email":"chirag.jain889@gmail.com","Linkedln":"https://www.linkedin.com/in/chiragkankrecha/","Whatsapp":"+33745376786","Skills":"I’m a technologist and founder with experience leading global technology initiatives across multiple countries, and currently working for loreal as the lead of their api platform (api.loreal.net). As a founder, I’ve built and operated a food-tech startup in India, giving me hands-on insight into the HoReCa and retail sectors.

Tech skills: Product Management, API Platforms, Food Tech, Automation, Cloud Integrations, and emerging expertise in AI applications.

Core skills: Team Leadership, Strategic Partnerships, Retail Operations, Brand Building, Data-Driven Decision Making, and Go-To-Market Strategy.","Problem":"While running my food tech brand, I realized how important personalization has become for modern consumers. Today, people rely heavily on Google Maps or generic review apps to decide where to eat or drink — but these platforms aren’t designed for personal taste, mood, or context.

I want to solve this problem by building an AI-driven discovery experience that understands each user’s unique preferences and creates hyper-personalized recommendations for cafés, restaurants, local wines, breweries, and experiences in any city/location they visit. Current discovery methods are a lot of hops for a user where they need to search and manually narrow down on their search themselves. This can be more intuitive, proactive and in much lesser hops for the user. 

Using AI, data, and a generative interface(generative UI), the goal is to make finding your next great local experience(activity, cafe, drinks, food or anything else) feel effortless and uniquely “you.”","⁠⁠First users":"I’d start by launching in one city like Paris — it’s the perfect test market, and I’m currently based here. The focus would be on coffee and local food discovery, keeping the product hyper-niche and authentic. I’d partner with 10–15 high-footfall spots across key categories — cafés, wine bars, microbreweries, and restaurants — and list them as “founding partners.” Each would be requested to offer a small discovery reward (like 5–10% off) for visits made via the app, with tiered incentives to drive engagement.

To acquire the first 1,000 users, I’d focus on:

Organic storytelling — collaborating with local food bloggers, micro-influencers, and community pages to share “AI-curated city guides.” Each new user would answer a few questions to generate a personalized “Taste Map,” which they could share socially — creating built-in virality.

User-generated experiences — every shared map would highlight real Paris stories and curated visits, designed to be visually striking and social-media worthy.

Signup rewards — like a free coffee or drink when visiting a partner venue through the app, if referral partnerships aren’t in place.

Partnering with the walking tours - I'd partner with the walking tours so they can refer us end of their tours, and we will have some sign up incentives via the signups made from them.

Early adopters would come through curiosity and word-of-mouth — drawn by the promise of finding hidden gems that match their taste. Paris has that ripple effect where people go and tell their friends to visit — and I’d leverage that psychological behavior to drive organic followership.

Above are some generic ideas, and I would like to make a data driven decision. Do an MVP and assess and analyse what all techniques we should use in the pilot phase of growth and then build it up from there. ","Favorite startup":"My favorite consumer startup story is an indian startup named Zomato — because it started with something very real and relatable: helping people discover where to eat. What began as a simple menu-listing platform in Delhi grew into a global brand that changed how people experience food, reviews, and local dining culture.

While i was running my food tech business, I onboarded multiple my restaurants on Zomato and saw firsthand how it connected diners to local food but lacked true personalization. That experience made me realize how AI could create more intelligent, tailored discovery and create a next generation of a personalisation engine.

Zomato inspires me because it built trust through community, design, and storytelling — proving that solving a deeply local problem thoughtfully can scale globally.","About us":"Other","Solo team":"solo","Availability":"yes","Apply accelerator":"what is","Other":"Social Media"}},{"id":"recEwXmaK7lNmm4L7","createdTime":"2025-10-17T07:32:57.000Z","fields":{"First name":"Antonio","Last name":"Moricca","Email":"moricca.antonio@gmail.com","Linkedln":"https://www.linkedin.com/in/antonio-moricca/","Whatsapp":"https://github.com/antoniomoricca","Skills":"Data Science, AI, Mechanical Engineering, Control System","Problem":"I’d love to explore how AI, especially large language models for interpreting visual data combined with reinforcement learning, can be used to make robots learn and adapt to complex environments. I don’t have a specific application domain in mind yet, but I’m excited by the challenge of turning these technologies into practical, real-world solutions.","⁠⁠First users":"Data Science, AI, Mechanical Engineering, Control System","Solo team":"Solo","Availability":"Yes","Apply accelerator":"Yes","Notes":"0"}},{"id":"recFM6JZVkhlRmmMZ","createdTime":"2025-10-13T17:42:32.000Z","fields":{"First name":"Alexis","Last name":"Faure","Email":"devalexisfaure@gmail.com","Linkedln":"https://linkedin.com/in/faure-alexis","Whatsapp":"+33 6 63 39 87 15","Skills":"I'm a senior software engineer with deep expertise in full-stack development, Cloud/DevOps, and AI. Over the past two years, I've been building and launching AI-powered products such as koloc.app and velian.io, while leading AI initiatives as Senior SWE & Head of AI at my current company. I also freelance as an AI Solution Architect (currently for getkanal.com), helping teams design and deploy production-grade AI systems end to end.

My biggest challenge is distribution. I'm not a marketer by training, but I’m actively building my audience and learning growth strategies. I've experimented with Reddit marketing for Velian with decent traction, and I'm eager to double down on that front.","Problem":"I love automating repetitive and boring tasks with AI. It's a recurring theme across everything I build:
- For Velian, I was tired of manually wiring nodes in n8n, so I built a natural language workflow builder to generate automations instantly.
- For getkanal.com, I built a conversational AI on WhatsApp to help e-commerce merchants handle customer support and recommend products automatically.
- At work, I design and deploy AI workflows to eliminate redundant internal processes, boosting efficiency across teams.
- Currently, I'm building Moraine, a tool to automate API documentation end-to-end; fully in public so you can see how fast I ship : https://x.com/_0xAlexis/status/1976738493222052005 (FR)

In short: I'm obsessed with using AI to remove friction, save time, and turn complex workflows into simple automated systems.","⁠⁠First users":"For B2C, I'd go full organic with a content engine optimized for virality. My strategy would be:
- Identify emotional or highly shareable use cases => create 5–10 TikToks/day showcasing real outputs & quick tutorials.
- Use Reddit/X to seed early communities (e.g. relevant subreddits, niche forums) and drive traffic to the product.
- Optimize landing pages and onboarding for fast activation (wow moment in <30 seconds).
- Layer SEO/GEO to compound growth over time (e.g. programmatic landing pages, use-case blogs).

For B2B, I'd complement with organic posts on LinkedIn/Reddit/X and fully automated cold outreach (email/DM) powered by AI.
The focus is speed of iteration, volume of content, and leveraging viral loops early to reach the first 1,000 users fast.","Favorite startup":"Cursor. They nailed timing, product, and distribution. They focused on a highly engaged niche (developers) and shipped a 10x better experience than incumbents like Copilot. Their build in public approach, viral developer content, and tight product loops led to massive organic growth without relying on ads. It's a perfect example of how a focused, well-executed consumer AI product can dominate quickly","About us":"Friends","Solo team":"solo","Availability":"yes","Apply accelerator":"Yes","Notes":"ONBOARDED","Yes/No - Feedback":"YES/ Living in Bordeaux, but okay to come weekly, plan to move to Paris/ Nice vibe/Tech profile/He is building in B2b documentation stuff for it teams - just showcase building in public/ open to pivot to b2c"}},{"id":"recFSoH0KAlb4Snjv","createdTime":"2025-11-18T16:52:09.000Z","fields":{"First name":"Rémi ","Last name":"Adon","Email":"remi.adon@sciencespo.fr","Linkedln":"https://www.linkedin.com/in/remiadon/?locale=en_US","Whatsapp":"+33679504111","Skills":"Data Science + Code
Finance
No previous experience with building agentic pipelines / rag systems etc ...
","Problem":"We have a need to invest in our economy in Europe, but retail investors heavily rely on saving plans.
Generally speaking, consumers don't understand the financial products they subsbribe to, because of their complexity and the small universe of products available at their retail bank. This is changing thanks to platforms like Revolut or TradeRepublic, but that does not mean consumers know what product to choose, why, and how to build a coherent portfolio. Simple risk management guidelines are often missing from their approach.
Drawing a parallel with buying groceries at a grocery store, we fill our baskets with processed food (etfs, funds, etc ...) that we pick from shelves with very poor choice. If we all know that it's healthier on the long run to fill a basket with raw food and cook it ourselves, why don't we do the same with our money ? The AI assistant I am thinking of reasons on \"raw\" financial products (eg. stocks) and provide you with a bespoke recipe, depending on your preferences and ESG criteria.","⁠⁠First users":"A freemium platform. Consumers would come to the platform and get a service that's not available anywhere else, but limited enough to get them to create an account and subscribe to a paid version.
Communication would help as well, although I have no prior training in this field. I have already listed a couple of medias for each type of audience to target
