- it takes time to create, and you will make mistakes ; 
- if you don't overwork 99% of people, you will not be better than 99% of people ; 
- scaling is not especially become better yourself, is being able to give people mission they will handle better than you. 

Today, my only focus is work on my new project and keep learning stuff everyday. 
I know how to create, I know how to sell, I know how to manage. 

And I am definitely not afraid to brake doors if I don't find the key.  


Now, I work 7j/7 from 8h to when i cannot anymore in my appartement. If you give me a desk tomorrow, be sure I will be there as often as I can. ","Problem":"The problem we solve is \"how can we put the right data, at the right moment, in front of the right person ?\"

Nowadays, companies have so many differents software that consolidating data from all of them has become a full part time job for numbers profils (CFO, CRO, RevOps). 
It takes approximately 8 to 10 hours per week for a CFO to find data, analyse it take it into consideration before making the right move for the company. 

This is where we come. 

With Sinial, this is done. 
We have create a complete financial cockpit that provide KPI's from all you different sources, and place them in front of your goals of this year, and results of last year. 
We analyse them to understand how they have reach this result and give you different options of how you can use it. 

We consolidate data and give it context so you can just be focus on how to use it. 

Our target is CFO, CRO and RevOps (and CEO) of SMB companies. 

We are working on the project since february, validated a true traction and different mentors (ex CFO of Qonto & Pigment, ex Country manager of PeopleDoc, CFO of Aviv Group, CEO of Magma, ex CFO of Le Slip Français), and we are selling our first POC now (DevoTeam, MeteoDyn, Grof). 

End of 2025 will be fully dedicated to launch POC and take feedbacks so we can arrived on the market at the end of Q1 2026. 
Also validated 200K of BA. ","⁠⁠First users":"First, create a PLG, not a SLG. 

Then, two options : 
- first : you have money to spend on marketing 
-> build no-brainer offer sponsored by a no-brainer adds : example : \"stop waisting money for only 4,99€/month. Let us manage your day-to-day wallet, stay focus on enjoying your life\"
-> launch adds on Instagram and TikTok, focus on 25 - 45 years, living in big cities. 
-> give a free month for every referral 
-> once you reach 1000 users, increase price for new user to 9,99. 
-> launch a 19,99 offers for the biggest spenders. 1M ARR shouldn't be so far. 

- if you have no budget : 
-> focus on lead magnet post on LinkedIn at least 2 months before official start
-> create your community before and keep them hot with a weekly newsletter
-> integrate partnership with influence in your ICP
-> no-brainer offer 
-> give one month free for referral

Shouldn't be long to reach 1000 user for each option. ","Favorite startup":"WhatsApp. 
Because they perfectly managed their scaling phase instead of focusing hiring. 

This should be the goal of every CEO instead of staying focus on raising money. ","About us":"Email","⁠⁠Refer":"My co-founders. 

If I can leave a last word, I would just say this : nothing is going to stop me chasing my goals. But if I have better conditions and am surrounding by smarter people, I will use it as much as I can, and give back as much as I can also. Thanks for reading me. ","Solo team":"team","Availability":"yes","Apply accelerator":"Yes","Notes":"0"}},{"id":"recKdCL0in16gn6Qv","createdTime":"2025-11-09T23:05:48.000Z","fields":{"First name":"Sophia","Last name":"Tang","Email":"sophia.tang3000@gmail.com","Linkedln":"https://www.linkedin.com/in/xue-tang/","Whatsapp":"+16147353654","Skills":"I’m a full-stack software engineer and AI builder. I’ve designed and deployed multiple AI products end-to-end, from AWS Bedrock-powered chatbots to consumer apps using FastAPI, Next.js, and Claude. My strengths are rapid prototyping, product sense, and translating messy ideas into polished MVPs. I move fast, validate early, and build with both code and empathy.","Problem":"I want to help people think, learn, and grow better with AI, not just use it for shortcuts. Most people consume knowledge but struggle to apply it. I’m building tools that turn insights (from books, conversations, or data) into personalized action plans and reflection loops. The goal is to make personal growth as customized, engaging, and lasting.","⁠⁠First users":"I’d do things that don’t scale. When I launched BookShift, I literally showed up at Harvard with a clipboard, asking students to sign up. Even the smartest students in the world admitted they struggled to apply what they learned. That insight shaped the product and convinced more people to join. 
I’d repeat that: start with real conversations, share early builds in public, personally onboard the first 100 users, and turn them into my first organic growth channel to grow to 1000. People join when they feel the mission, not when they see an ad.","Favorite startup":"Instacart. I heard their story at a YC event. They didn’t wait for permissions or partnerships; they just needed to know if people wanted it. They photographed every product in Trader Joe’s, put them online, and manually fulfilled orders. It wasn’t scalable, but it proved the demand. I love that spirit of testing the core hypothesis first, moving fast, and taking smart risks. That’s how I build too: launch an ugly version, validate quickly, polish later.","About us":"Community/Alumni","Solo team":"solo","Availability":"yes","Apply accelerator":"Yes","Other":"Abhinav Singh "}},{"id":"recKj1bgJWswED8zA","createdTime":"2025-10-14T15:39:16.000Z","fields":{"First name":"Marc","Last name":"Davoust","Email":"marc.davoust@astrale.ai","Linkedln":"https://www.linkedin.com/in/marc-davoust-7b9626174/","Whatsapp":"+33780372028","Skills":"Hyper creative + vision
Find the higher ROI technical solution for a given real life problem
Implementing automations
- inside scale up -> created innovation department
- for various customers with SyncPulse during one year : agentic chat support for bank, massive documents processing, resumes qualification, realtime coach for sales calls, ...
Leadership


And..
Run Fast
Plays the piano
","Problem":"I'd like to solve for ever the boring, repetitive office tasks
I would have been my first user at Syncpulse. I know better than nobody all the existing tools on the market and their limits.
I know the real pain of people who wants to build once instead of running every day.","⁠⁠First users":"1 -> 50 -> meeting people with qualitative meetings (feedback on the use of the product, feedback on the product, etc)
50 -> 250 controlled spread to ensure scaling capacity
200 -> 1000...0000 viral hack (i've some ideas)","Favorite startup":"wordware is a competitor, but amazing: https://blog.wordware.ai/twitter-roast-ai-with-llm-orchestration","About us":"Community/Alumni","Solo team":"team","Availability":"yes","Apply accelerator":"what is","Notes":"0","Other":"station f"}},{"id":"recKjIp6amQot62QG","createdTime":"2025-10-14T09:59:26.000Z","fields":{"First name":"Hugo","Last name":"Blum","Email":"hugogblum@gmail.com","Linkedln":"https://www.linkedin.com/in/hugoblm/","Whatsapp":"+33 6 82 63 33 16","Skills":"Technical Head of Product

I have a comprehensive product vision, covering finance, digital marketing, and design. I also possess strong technical skills, with a solid understanding of code, infrastructure, and AI. I’ve worked extensively with no-code and automation tools (such as n8n, Bubble, Webflow, and FlutterFlow). However, my current focus is on what I call \"vibe coding.\"

To be honest, my sales skills are a weak point. While I started my professional career as a business developer and have the basics, it’s not something I particularly enjoyed. I’m fully aware that sales are essential for a solo founder, so I’m actively improving in this area especially by leveraging automation.","Problem":"Today, companies face a real challenge: standing out in an AI-driven environment.

I’m not talking about simply being mentioned by an AI. The goal is to have the ability to sponsor a product that genuinely matches a user’s query without relying on behavioral tracking and, above all, without biasing the AI. This can be achieved through a dedicated and specific sponsored pipeline, ensuring both accuracy and trust.
The key is to identify the right product among thousands, delivering real value to the user at the exact right moment.","⁠⁠First users":"I will continue to do what I’m doing now:

Develop the best chat tools with a strong value proposition, offered for free to truly harness the power of AI privately and with access to over 50 models.
Invest in tokens to test user retention and optimize the pipeline during a dedicated trial period.
Focus on marketing to reach users where they are.

After this dedicated period, I will identify beta testers and provide them with detailed data such as visit metrics, sponsorship ratios, and more.","Favorite startup":"I believe Finary is one of the best consumer startups because it addresses a real pain point for a massive audience: financial education. Like them, I’m convinced that without financially educated people, we cannot create sustainable value.","About us":"Other","Solo team":"solo","Availability":"yes","Apply accelerator":"what is","Notes":"0","Other":"Slack AI Discipline"}},{"id":"recL3MCjJusWATw7N","createdTime":"2025-10-15T19:01:07.000Z","fields":{"First name":"Jermiah","Last name":"Jerome","Email":"jermiah.jerome96@gmail.com","Linkedln":"https://www.linkedin.com/in/jermiah-jerome/","Whatsapp":"+33783719197","Skills":"https://www.linkedin.com/in/jermiah-jerome/","Problem":"Small-scale businesses often face limited budgets, small teams, and a lack of technical expertise. While they need to deliver professional customer service to remain competitive, they cannot afford dedicated support teams. Hiring human agents can be up to 90% more expensive than AI-based solutions, making it financially unfeasible for many.

These businesses also lack the technological capabilities that give larger players a competitive edge. We aim to bridge this gap by empowering every small and medium business with accessible, advanced, and powerful AI solutions that automate operations and enhance customer experience all without requiring technical infrastructure or coding skills.

We like to build an AI SaaS that lets businesses launch  business agent chatbots for automation in under 5 minutes.","⁠⁠First users":"We’d start by activating our existing network and early supporters through personal outreach and demos, focusing on solving real problems and building trust. Then, we’d amplify traction via referral incentives, niche community engagement, and targeted social media campaigns turning early conversations into our first 1,000 loyal users.","Favorite startup":"SkillSphere is a standout consumer startup success story because it democratized digital upskilling for India’s small towns. By making learning accessible on mobile, in local languages, and through college partnerships, it unlocked new markets and created real social impact empowering millions of youth beyond big cities.","About us":"Other","Solo team":"team","Availability":"yes","Apply accelerator":"Yes","Notes":"0","Other":"Station F Slack"}},{"id":"recMzbhlIJcJH7Z2z","createdTime":"2025-11-03T13:30:49.000Z","fields":{"First name":"Laura Daniela","Last name":"Arias Ramirez","Email":"lauradanielaar@gmail.com","Linkedln":"https://www.linkedin.com/in/laura-daniela-arias-170794/","Whatsapp":"+33761528450","Skills":"Entrepreneurship, Business Modeling, Strategic Vision, Leadership, Growth Marketing and User Acquisition- Marketing Optimization, budget management, performance tracking and scaling. SEO and localization Experience. Client Relationship Management, Consultative Selling, Project Management, Events Management and Community Building. Gamification Strategies, Creativity and Innovation, Web3 knowledge, interest in longevity and well-being. Highly adaptive and creative but also analytical and number's driven. ","Problem":"Empower the fullest expression of human genius by using AI tools to decode individuals’ neural physiology and epigenetic data, to then enable the right resources and environments that unlock their highest potential.","⁠⁠First users":"Have a granular target audience definition with a well-sounded understanding of my customer and its consumer behavior, clear understanding and assessment of their main pain-points and focus on the core one(s) I'm aiming to solve. Meet them at their consumption/communication channels through tailored messaging that resonates and speaks to their pain-points or triggers a desired action (join waitlist/download/sign up) build with different content strategies, drivers, creatives and optimization types tailored to each channel. Monitor and assess performance, gather data and take actions scale or descale where needed, run A/B tests where needed to improve results. Build in public, share progress in all social channels to build curiosity and credibility while attracting those early-adopters who have a buy-in for the idea and wanna experiment it and help co-create it. Have open-direct easy bidirectional communication with my early users and agile feedback loops and iterate dynamically based on learnings. Reach out and partner with SMEs and media channels that are aligned with my impact and are excited to spread the word and magnify the message. Partner with micro-influencers and stablished communities to reach to my target users through UGC appealing to their trustability and genuine voices. Have a direct bidirectional communication channel with my first users, well defined feedback loops and quick iteration to enhance product based on quantitative and qualitative learnings. ","Favorite startup":"Canva's is a recent one I learned about and resonate with. Melanie didn't start as a tech CEO or had tech background, as a teacher at a university she was experiencing first-hand how much overcomplexity and friction existed in the current landscape of design tools, limiting their access. She was aware of the pain and envisioned an experience where designing was quick, easy and accessible. Started with a simple tool that took off which opened up the door to further impact. With no connections, no technical background and no flashy titles as Ex-Something and away of Silicon Valley's hub, she landed investment from Bill Tai because her vision was clear. She wanted Canva to do for design what Google did for search. Instead of going for the obvious pool of user's that Adobe was already serving Canva targeted everyone else, tapping into a massive under-served market. Simple product with drag-and-drop and freemium model destroyed any potential barriers for user's engagement. With millions of users and a valuation peaking at 40 billion she became one of the youngest self-made billionaires without following the well-walked noisy path many choose to follow. What I truly admire most is how truly impact driven the founders have been by pleading donating 30% of the company's value to social impact causes. ","About us":"linkedin","Solo team":"solo","Availability":"yes","Apply accelerator":"what is"}},{"id":"recNpLjOGrSTJiGCY","createdTime":"2025-10-15T15:42:57.000Z","fields":{"First name":"Jules","Last name":"Maregiano ","Email":"jules.maregiano@gmail.com","Linkedln":"https://linkedin.com/in/i-got-banned-from-linkedin","Whatsapp":"0675635217","Skills":"I'm a curious traveler, a marketer according to my masters degree, a hobby developer (10y on Ruby on Rails), and Ops manager by trade.","Problem":"LOCALIZATION! Digital products are being sold as if everyone was an American consumer: Price, culture, access. I believe AI can empower digital businesses to sell across the Internet much more smartly (and increase sales in the process), giving in the process access to many more tools to the developing countries. ","⁠⁠First users":"SEO and SEO free tools scaled via AI, and targeting niche problems that resonate with founders working between the western and emerging markets. Oh, and a lot of cold DMs too ;)","Favorite startup":"Probably Luis Von Ahn's story, before Duolingo, he created some early captcha version and when realizing he was wasting millions of the world's collective hours turned it into a system to transcript old books. I love it because it takes one issue and turns it into 2 wins!","About us":"Friends","Solo team":"solo","Availability":"yes","Apply accelerator":"Yes","Notes":"0"}},{"id":"recOLIpNRuuLOclT6","createdTime":"2025-11-12T01:35:15.000Z","fields":{"First name":"Vllaznim","Last name":"Bytyqi","Email":"vllaznimb@gmail.com","Linkedln":"https://www.linkedin.com/in/vllaznim/","Whatsapp":"+38349489199","Skills":"Vllaznim is a seasoned finance professional with over 15 years of experience in the banking sector and deposit insurance. He holds a Master’s degree in Financial Management from the University of Delaware and is deeply interested in fintech, blockchain, and the practical applications of artificial intelligence in business solutions.

His expertise in deposit insurance covers a range of important areas, including risk-based premium systems, bank exposure analysis, setting the optimal target level for deposit insurance funds and investment management. 

Vllaznim is known for his ability to combine innovative thinking with practical solutions. As the project lead for this innovative initiative, he will lead a skilled team of researchers and software developers. 
","Problem":"AI-Powered Investment Intelligence
Our startup addresses the critical need for data-driven precision in the massive $128 trillion global asset management market, specifically targeting institutional investors like Central Banks, Sovereign Wealth Funds, and Deposit Guarantee Schemes.

The Problem We Solve
Institutional investors currently struggle with fragmented data, opaque benchmarking, and a manual, high-friction process for selecting asset managers. This leads to suboptimal capital allocation, underperformance against peers, and high costs associated with external consultants.

Our Unique Approach
We are building an AI co-pilot that utilizes Retrieval-Augmented Generation (RAG) technology to solve this.

AI-Powered Benchmarking: We ingest proprietary global institutional investment data to provide real-time, traceable peer-group performance comparisons and deliver hyper-personalized recommendations for optimizing their Investment Policy Statements (IPS).

AI-Driven Matchmaking: We match investors to the most suitable asset managers based on the investor's specific objectives, risk profile, and the manager’s continuous performance metrics, replacing traditional, biased sourcing methods.

The RAG technology ensures our insights are grounded, up-to-date, and fully auditable by linking every recommendation back to its source data, which is essential for regulated institutional clients. https://docs.google.com/presentation/d/12iz0sZUP0DbXs5cVkpl6EWOVgsZPBADEwXqCG3ujP60/edit?slide=id.p1#slide=id.p1","⁠⁠First users":"I have already performed initial market validation and tested interest within a highly relevant subset of the institutional investor segment: Deposit Guarantee Schemes (DGSs).

Proof of Concept & Market Size
Sub-Segment Target: We have focused on Deposit Guarantee Schemes, which are under immense pressure to manage reserves conservatively yet strategically.

Validated Scale: This initial segment alone comprises more than 100 institutions globally with a combined total of over $450 billion in Assets Under Management (AUM).

Key Validation: Our preliminary discussions confirm that these institutions urgently need objective, AI-driven tools for performance benchmarking and unbiased asset manager selection, validating the core problem we are solving.

Unfair Advantage: Industry Network & Access
I possesses a unique, high-trust advantage due to deep involvement in the deposit insurance industry:

Network Access: I am an active member of the leading international and regional forums for this industry: the International Association of Deposit Insurers (IADI) and the European Forum of Deposit Insurers (EFDI).
This involvement provides a pre-built network and established credibility with the very decision-makers (CEOs, CFOs, and Investment Committee heads) we need to onboard. This dramatically speeds up the typical sales cycle and lowers customer acquisition costs within this highly conservative, trust-dependent market.","Favorite startup":"My favorite startup success story is LlamaIndex. LlamaIndex is the platform enterprises choose to build reliable AI apps with maximum reliability and control.","About us":"linkedin","Solo team":"solo","Availability":"yes","Apply accelerator":"Yes"}},{"id":"recOsA2pI2RFfTigM","createdTime":"2025-11-03T15:13:03.000Z","fields":{"First name":"Ayman","Last name":"Abdelmeguid","Email":"ayman@thephalanxproject.fr","Linkedln":"https://www.linkedin.com/in/ayman-abdelmeguid-425278a0/","Whatsapp":"+33640873399","Skills":"With a long diverse career over more than 20 years and across 4 continents, I have acquired some very core skills like International Leadership | Manufacturing | Supply Chain | Sustainability Transformation | Business and Brands Strategy | R&D & Innovation | Financial Management | Projects management | Organization restructuring
","Problem":"I am looking to contribute to solving the problem of overconsumption and plastic pollution","⁠⁠First users":"I will target the new generation who are invested in the planet issues. I will show them how AI can work for them and analyze patterns on their behalf to help them take more educated solutions. However I will make sure to show that AI is to serve and not to manipulate the decisions by being \"selective\" or \"directed\" through big corporates.","Favorite startup":"My favorite will be Uber as it is a startup that came with a brand new concept based on giving the consumer and the service provider a much bigger freedom and capability to choose how and what to use.","About us":"linkedin","⁠⁠Refer":"Yes, my co-founder in a lot of the ideas I am working on despite she is not in Europe but she is a very innovative young woman living in South Africa, her name is Sunita Gouws.","Solo team":"solo","Availability":"yes","Apply accelerator":"Yes"}},{"id":"recOvypg6G4lfmvV8","createdTime":"2025-10-17T07:32:57.000Z","fields":{"First name":"Christopher","Last name":"Ly","Email":"chris@popsize.ai","Linkedln":"www.linkedin.com/in/christopherhly","Skills":"Me (applicant): product, growth, finance, front-end development (HTML, CSS, JS/TS, Python)

Nicolas (my associate): AI model development (NLP, LLMs), data science, full-stack dev","Problem":"Find your perfect clothing size, for any product, any brand, anywhere in the world.
Without scanning or photos! :)","⁠⁠First users":"Me (applicant): product, growth, finance, front-end development (HTML, CSS, JS/TS, Python)

Nicolas (my associate): AI model development (NLP, LLMs), data science, full-stack dev","Solo team":"Team","Availability":"Yes","Apply accelerator":"Yes","Notes":"0","Yes/No - Feedback":"NO / he is from Hook/already have a product in fashion consumer space/his profile is product/ maybe to join mid program, if the idea and feedback is  really good"}},{"id":"recOzzE5EdXHeHVvj","createdTime":"2025-10-18T13:50:37.000Z","fields":{"First name":"Dimitri","Last name":"Ewald","Email":"dimitri@climateclub.cc","Linkedln":"https://www.linkedin.com/in/dimitri-ewald/","Whatsapp":"+33 6 95 91 75 69","Skills":"Fast learner, quick thinker, and hands-on operator.
Execution under pressure, built and scaled a companies from scratch in a high demands sector (hospitality).
Analytical mindset from VC experience, strong at structuring and synthetizing complex problems.
Resourceful, I automate, simplify, and fix what doesn’t work.

Tools: Airtable, Softr, Fillout, HubSpot, LLMs, n8n, Make, PhantomBuster, Sales Navigator, Photoshop, Office.","Problem":"Friction
It is the invisible tax on everything we do. It’s the small delays, manual steps, or unclear processes that slow people down and kill momentum.","⁠⁠First users":"Step 1: Target a specific niche where AI brings a clear painkiller. Take 2 weeks to talk to 50 to 100 people to understand perfectly well the needs.
Step 2: Build a first version and ask to the 50 to 100 people I talked to to use it for free for a week and give me feedbacks --> Maybe 1/3 will do it.
Step 3: Upgrade the product with the feedback.
Step 4: Partnerships with 5 micro-infuenceurs in the niche (under 30k followers) to find the first 100-500 customers.
Step 5: Use storytelling & transparency by sharing every iteration, every learning publicly to create early believers.
Step 6: Build a viral smart social network campaign --> No need for high budget, good visuals, triggers, etc.
Step 7: Partnership with small business owners in a win win relationship.","Favorite startup":"Spotify as because it rewrote the rules of an entire industry.
Made music easy, legal, and addictive, instantaneous. Combined perfect timing, great product intuition, and relentless execution.
I admire how they made something huge feel effortless. They changed to way people consume music worldwide in a slow, competitive, and traditional industry.","About us":"linkedin","Solo team":"solo","Availability":"yes","Apply accelerator":"Yes","Notes":"ONBOARDED
