{"records":[{"id":"rec13rR8dda9tJ0zn","createdTime":"2025-10-17T07:32:57.000Z","fields":{"First name":"Sarah ","Last name":"Lecoeur ","Email":"saraah.lecoeur@gmail.com","Linkedln":"http://linkedin.com/in/sarah-lecoeur-753565364","Skills":"Engineering: building proprietary AI algorithms and quantitative trading models.
Product: designing scalable, automated investment tools for financial decision-making.
Design: creating intuitive dashboards and visualizations for complex financial data.
Growth: developing strategies to reach investment firms and asset managers globally.","Problem":"We aim to solve the problem of biased or inefficient investment decisions in finance. At Full AI Lab, we use AI to analyze vast financial datasets and generate automated, robust, and human-bias-free investment decisions. Our goal is to make financial markets more predictable and accessible through reliable and scalable tools.","⁠⁠First users":"Engineering: building proprietary AI algorithms and quantitative trading models.
Product: designing scalable, automated investment tools for financial decision-making.
Design: creating intuitive dashboards and visualizations for complex financial data.
Growth: developing strategies to reach investment firms and asset managers globally.","Solo team":"Team","Availability":"Yes","Apply accelerator":"Yes","Notes":"0"}},{"id":"rec1ilfEAMwCFuH0n","createdTime":"2025-10-17T07:32:57.000Z","fields":{"First name":"Fah Yik","Last name":"Yong","Email":"fahyik.yong@gmail.com","Linkedln":"https://www.linkedin.com/in/fahyik/","Whatsapp":"https://github.com/fahyik","Skills":"Product + Engineering","Problem":"Consumer health.
Two points:
1. We are always behind in our health, often when something goes wrong it's too late.
2. We often have the information we need to maintain good health, but execution is hard.","⁠⁠First users":"Product + Engineering","Solo team":"Solo","Availability":"Yes","Apply accelerator":"What is Pioneers Accelerator? I need more info","Notes":"ONBOARDED","Yes/No - Feedback":"YES/missing first week only due to planned trip/ goal is to optimise nutrition/ wellness app/ technical profile"}},{"id":"rec2H5tFp1YHltFtq","createdTime":"2025-10-21T08:32:45.000Z","fields":{"First name":"Noyan","Last name":"Bilge","Email":"noyan.bilge@klartai.com","Linkedln":"https://www.linkedin.com/in/noyan-bilge/","Whatsapp":"+33672418345","Skills":"- Leadership, management & business vision (BlaBlaCar / Job&Talent)
- AI strategy & governance (compliance, ethical AI)
- Multi-model LLM workflows (OpenAI, Anthropic, Google, Meta)
- Product design & go-to-market for AI platforms
- Growth hacking & enterprise user acquisition (6K+ orgs at Klart AI)
- Scaling operations & data-driven processes (BlaBlaCar, Job&talent)","Problem":"Making AI truly accessible and useful for everyday business operations. I'm passionate about solving the gap between complex AI capabilities and practical, user-friendly applications that can transform how small to medium businesses operate and make decisions.","⁠⁠First users":"I'd focus on solving a specific pain point for a niche community first. Launch with a free tier targeting early adopters on Product Hunt and communities, leverage content marketing through case studies and demos, partner with complementary tools for integration opportunities, and use referral incentives to encourage organic growth from satisfied users.","Favorite startup":"OpenAI's ChatGPT launch. What impressed me most was how they made complex AI accessible to everyone through an intuitive interface, achieved viral organic growth through genuine utility, and created a new category while maintaining focus on user experience. Their approach of gradual capability release while building trust resonates with how we think about AI adoption.","About us":"linkedin","Solo team":"team","Availability":"yes","Apply accelerator":"Yes"}},{"id":"rec2M0lAQ14P8g0ig","createdTime":"2025-10-17T08:26:08.000Z","fields":{"First name":"Aziza","Last name":"Chaouachi","Email":"aziza.chaouachi@gmail.com","Linkedln":"https://www.linkedin.com/in/aziza-chaouachi-243aa6165/","Whatsapp":"+33646725979","Skills":"What I bring:
• Scaling muscle: Built Leavy.co from scratch → 100 cities, 6 offices, profitable growth ;.
• Capital & influence: Raised $20M, managed top investors, navigated acquisition ;
• Talent magnetism: Hired, inspired, and retained top performers under pressure ;
• Execution edge: Proven ability to turn vision into playbooks, cadences, and results.

In short: I bring the scar tissue of a founder, the rigor of an operator, and the ambition of a builder.","Problem":"Adoption of AI by micro, small and medium businesses.","⁠⁠First users":"Community effects, leveraging every client to become an Ambassador of the brand & community.","Favorite startup":"My favorite consumer startup success story is Airbnb.

Airbnb redefined access, community, and belonging — turning idle capacity into meaningful human and economic value. It transformed a simple consumer behavior (staying somewhere) into a global movement built on trust, design, and technology.

This story resonates deeply with me because I’ve lived a parallel journey with Leavy.co, which empowered the same new generation of travelers and hosts through digital inclusion. Airbnb’s ability to blend tech scalability with authentic human connection—while navigating regulatory, financial, and societal challenges—is a masterclass in strategic resilience and purpose-driven growth.

It’s a powerful example of how consumer startups can go beyond convenience to reshape industries, communities, and culture, while remaining laser-focused on user experience and trust.","About us":"linkedin","⁠⁠Refer":"n/a","Solo team":"solo","Availability":"yes","Apply accelerator":"dont know","Notes":"0","Yes/No - Feedback":"?YES/ interesting profile, but a bit pushy/ founder of travel tech, raised 22M usd","Maxime Comments":"MAYBE 5/10 - very experienced, unsure about culture fit
","Decision":"?"}},{"id":"rec2ryA9bSHHFX7HL","createdTime":"2025-10-13T15:13:40.000Z","fields":{"First name":"Giuseppe ","Last name":"Graziano","Email":"giuseppejgraziano@gmail.com","Linkedln":"https://www.linkedin.com/in/ggrazianoknapp/","Whatsapp":"+33 7 79 99 02 13","Skills":"- Building AI tools solo with OpenAI API and Telegram bots (last year, testing ideas for my project)
- Emotional and physical resilience, being able to pivot fast without being overwhelmed (past few years of pivoting)
- Managing small to medium-sized teams in startups (the past 7 years)
- Facilitating communication between the technical and the non-technical profiles within a company (tech recruiting experience)
- Fluent in English, French, Italian, Slovak, intermediate in Russian & Ukrainian (Double nationality + lived in 13 countries in the past 10 years)","Problem":"A problem I’d love to solve with AI is the fragmentation and opacity of how freelancers get paid, taxed, and recognized for their work.

Most independent workers spend hours issuing invoices, chasing late payments, and navigating complex tax systems that weren’t designed for digital or cross-border work. The process is inefficient, error-prone, and excludes millions of people who can’t afford accountants/lawyers or don’t understand local regulations.

I want to use AI to make this invisible. Imagine a system where a freelancer simply messages a bot (On Whatapp, Telegram, Signal; or even via a simple SMS) — “Send invoice to X for €500” — and the AI automatically generates a compliant invoice, verifies client data through public registries, and processes payment via stablecoins. The funds would be instantly and transparently split between the freelancer and the tax authorities, creating a seamless, compliant transaction in real time. (I already have the right ties with the relevant public institutions in France) 

*This solution is very much inspired by my time spent in Africa and working indirectly with M-Pesa and its partners.","⁠⁠First users":"I’d start by identifying a small community that already feels the pain my product solves, for example, freelancers struggling with invoicing or creatives wanting to automate tedious workflows.

’d start with people who already know and trust me, say freelancers in Paris, and onboard them manually, collecting feedback one-on-one. When the product feels like it was built for them, they’ll naturally share it. I’d then publish 3–4 authentic user stories: short videos or posts showing how the tool saved time or simplified real work. People don’t adopt new tech because it’s “AI”, they adopt it because it makes life easier. I would probably then try to leverage niche online spaces such as Reddit, Discord, and Telegram groups are where early adopters live. I’d join conversations genuinely (not pitch) and share the tool when it fits naturally. We want at this point that our early users become our most passionate ambassadors.
I would later run a simple referral loop, where early users would get a small reward, like a feature unlock, for each friend who joins. It’s cheap, measurable, and compounds fast if the product really works. 

The thing to keep in mind here is to focus on retention before expansion : I’d spend the first few weeks understanding why users come back (or don’t). Once 100 people are using it regularly and loving it, the next 900 come easier, through iteration, not ads.

I’d get to the first 1,000 users without spending on ads, just by creating something real, useful, and shareable.","Favorite startup":"I’d say M-Pesa in Africa.

It started as a simple way to transfer mobile credit in Kenya and ended up redefining what financial inclusion could look like. What’s amazing is that while banks were wondering how to evolve their digital products, people on the ground were already using M-Pesa to build a whole financial ecosystem (paying school fees, sending remittances, running businesses, and so on), all from basic mobile phones.

It showed that innovation doesn’t always come from high tech, it comes from solving real problems in the simplest, most accessible way possible.","About us":"Email","⁠⁠Refer":"No one in particular right now","Solo team":"team","Availability":"yes","Apply accelerator":"Yes","Notes":"?"}},{"id":"rec3RXTRfD1An1etJ","createdTime":"2025-10-31T14:44:28.000Z","fields":{"First name":"Mathis","Last name":"Maunick","Email":"mathis.maunick@gmail.com","Linkedln":"https://www.linkedin.com/in/mathis-maunick/","Whatsapp":"+33 6 02 61 89 69","Skills":"My profile is built on three pillars: Product Strategy, Tech-Agnostic Execution, and Entrepreneurial Grit.

1. Product Strategy (Learned from my AI Agency):
My AI agency was my training ground. I learned firsthand how to translate ambiguous client problems into concrete technical roadmaps. I managed everything from initial scoping and stakeholder alignment to final delivery. This experience, combined with my ESSEC business degree, taught me how to find the real problem and define the right product to build.

2. Tech-Agnostic Execution (Learned as an Engineer):
My years as a Data Engineer taught me to master foundational principles, not just specific tools. Today, I leverage LLMs as powerful learning accelerators, which allows me to become productive in any required technology stack in days, not months. This removes technical limits and lets me focus on building the best solution, fast. I architect and code myself.

3. Entrepreneurial Execution (Learned from my Supplement Brand):
Launching a food supplement brand from scratch taught me the skills not covered in engineering school: sales, go-to-market strategy, supply chain management, and pure resilience. I built the growth engine and acquired the first customers with zero budget. This proves I can build not just a product, but a self-sustaining business.","Problem":"My ambition is to solve the critical problem of brand invisibility in the post-search era. I want to build the tools that allow companies to control how they are portrayed by AI, ensuring they are cited as the primary source of truth in their domain instead of being replaced by a competitor.

The Problem: A Silent Traffic Extinction
We are shifting from a \"Search\" paradigm of scanning links to an \"Ask\" paradigm of getting an instant answer. If leading AI models like GPT-4 and Gemini don’t know a brand or can't trust its data, it simply vanishes for the user. This is not just about losing SEO clicks; it's about being erased from consideration.

The Market: A Multi-Billion Dollar Shift
This isn't a niche problem. It's a massive, emerging market. Analysts already value the Generative Engine Optimization (GEO) market at nearly $1 billion for 2025, with forecasts showing it will explode to over $30 billion by 2034. This is the budget that will shift from traditional SEO as companies realize their old playbook is obsolete.

The Solution: A GEO Platform
I envision a SaaS platform that allows companies to:

1 - Measure: Quantify their citation frequency by major AI models on key topics against their competitors.
2 - Diagnose: Pinpoint the semantic weaknesses that cause AIs to ignore them, such as unstructured data or low-trust signals.
3 - Optimize: Generate \"knowledge capsules\", content blocks formatted specifically for LLMs to easily cite and reuse.","⁠⁠First users":"I know exactly how I'll get my first 1,000 users. My strategy isn't about hope. It's a machine built to turn apathy into urgency by showing undeniable proof.

First, I create demand with data. This will bring in 300 users.
I’ll start by building an engine that audits thousands of brands. It will find every instance where an AI recommends their competitor over them. With this proof, I'll send hyper-personalized alerts to 2,000 key decision-makers with a single, powerful screenshot showing their brand being erased. This isn’t a sales email. It’s a critical alert they can’t ignore. Getting a 15% response is a clear and repeatable path to the first 300 motivated users.

Next, I build a viral loop. This will bring in 400 users.
I’ll take that data and make it public with the \"AI Visibility Index\". This isn't just a blog post. It's a public leaderboard that taps directly into ego and fear. Winners will share their success. Losers will come directly to me to fix their rank. This becomes a powerful loop of social proof that brings in the next 400 users.

Finally, the product itself pulls people in. This will bring in 300+ users.
The product itself becomes the main driver of growth. A free, instant audit tool on the homepage will let anyone see their risk score. This isn’t a simple gimmick. It’s our best salesperson, working 24/7 to convert visitors into the next 300+ users.

This is more than a plan. It's a growth flywheel. Each part fuels the next. The proof creates the first users. The index turns them into viral stories. The free tool captures all the new demand. It’s a system designed to deliver 1,000 motivated early adopters who already know they need us before they even sign up.","Favorite startup":"My favorite success story is Le Petit Ballon. Their genius was not in selling wine, but in solving the universal anxiety of choosing it.

They understood that for millions, the real friction was not access to wine but the psychological barrier of the wine aisle. The fear of making a bad choice leads to analysis paralysis, so people buy the same \"safe\" bottle every time. It’s a huge, unaddressed emotional market.

Their solution was a subscription box curated by a top sommelier. This was an elegant masterstroke in user experience. It outsourced the risk of choice and transformed a moment of anxiety into one of discovery and delight. The subscription model is brilliant not just for recurring revenue. It also builds a ritual, turning a simple transaction into an anticipated monthly experience.

This model allowed them to build a loyal community of over 150,000 subscribers. More importantly, they demystified an intimidating category. Through their tasting notes and magazine, they made wine knowledge accessible and enjoyable, never snobbish.

They didn't just sell a product. They created a more confident and educated customer base.

For me, Le Petit Ballon is the perfect example of a startup that achieved massive success by focusing on the human emotion behind the purchase, not just the product itself.","About us":"linkedin","⁠⁠Refer":"Yes, without hesitation: Paul Bordes, my co-founder in our food supplement brand.

Paul is an execution machine when it comes to customer acquisition. While I was focused on the product and operations, Paul built our entire growth engine from scratch. He is an expert in sales funnels and is obsessed with finding scalable ways to get the first 1,000 customers.

I know he is currently developing a new venture, applying this exact expertise. His energy, his growth-hacker mindset, and his ability to turn strategy into actual sales make him an ideal fit for a program like the AI Lab. He’s the kind of founder who builds, measures, and iterates until it works.","Solo team":"solo","Availability":"yes","Apply accelerator":"Yes"}},{"id":"rec3t6ITCC72oWMij","createdTime":"2025-10-17T07:32:57.000Z","fields":{"First name":"Moin","Last name":"Uddin","Email":"pay2moin@gmail.com","Linkedln":"https://www.linkedin.com/in/moin-uddin-1550a314/","Whatsapp":"https://github.com/miumoin","Skills":"Engineering, Video production, User experience","Problem":"Making chatbot being able to do more than just answering. Building Typewriting AI chatbot builder for professionals that can
- reduce frustration of delays in messaging
- re-inventing functions calling through dynamic CTA
- turning chatbot into a complete commercial interface
etc.","⁠⁠First users":"Engineering, Video production, User experience","Solo team":"Solo","Availability":"Yes","Apply accelerator":"Yes","Notes":"0"}},{"id":"rec4PTisLXlo4ZD1w","createdTime":"2025-10-16T23:13:06.000Z","fields":{"First name":"Riccardo","Last name":"Bordoni","Email":"ric.bordoni@gmail.com","Linkedln":"https://www.linkedin.com/in/riccardo-bordoni/","Whatsapp":"+393205622785","Skills":"GTM & Sales Strategy: 4-year experience scaling revenue for international companies, building regional GTM playbooks, partnerships. Owned GTM strategy for a consumer app I co-founded. 
Product & Growth Operations: Co-founded a consumer app. Experience in product development, user feedback loops, retention metrics, KPI tracking, funnel optimization.
Financial Strategy: P&L analysis, budget forecasting, CAC / LTV modelling, pricing strategy.
Data Analysis: SQL, Excel, Tableau, cohort analysis, A/B tests. Google Data Analytics Certificate.
Entrepreneurship: solid experience in entrepreneurial roles in US & EU. Built & scaled a social app to 10k downloads, 40% MAU, CAC Euro 0.50. BS concentration in Entrepreneurship.
Cross-Market & Cross-Functional Communication: Working across US & EU, collaborating with tech, design, operations, marketing; fluent English + Italian + French.","Problem":"Few people can truly answer, “Where do you see yourself in five years?”, and maybe that’s okay. We change every day, but it’s still hard to move forward without some sense of direction.
I use AI daily: to plan my diet, reflect on my mindset, and stay balanced. I’m 27, and each day I try to understand myself better and make smarter decisions. Recently, I thought about my younger brother, who’s 19. He has something I didn’t at his age: someone who knows him well and can guide him. Many young people don’t have that kind of support.
Even though AI supports me daily, it still lacks the depth and empathy of a human mentor. That’s why I started imagining an AI-powered platform that connects people with the right mentor for them - someone who truly fits their goals, mindset, and personality.
In a world where AI already helps us with everyday choices, I believe it could also help us find the right people to guide us: to give us purpose and direction when we need it most.","⁠⁠First users":"If I were to launch the AI consumer product described above, my go-to-market plan would focus on building traction locally first and expanding once we find product-market fit. I’d start with:
-Local GTM: focus on one city or community to build density and word-of-mouth before scaling.
-High-value mentors: onboard a few top-tier mentors (founders, ex–top-tier professionals) to attract users. To involve them early, I’d offer small equity shares or paid collaborations.
-University partnerships: offer access to the platform so students can benefit from mentorship.
-Social media strategy: share educational and storytelling content to attract both mentors and mentees.
-Ambassador program: reward users with credits for every friend they invite.

To reach the first 1,000 users:
-1 mentor with ~10k followers and 5% conversion = 500 users
-1 university partnership, 3k students at 5% conversion = 150 users
-Organic social content = 200 users
-18% of 850 users inviting one friend = 150 new users

This would bring us to the first 1,000 users.","Favorite startup":"A great example for me is Airbnb. Brian Chesky is one of my favorite founders, I personally use airbnb on a regular basis, and I am an airbnb host myself. I find their story inspiring: from being rejected by investors, with some saying “the market is too small”, to reaching a market cap of $74 billion. I also love that the company was started between friends. I met my co-founder at university, and after being best friends for eight years, we launched imin together. I really believe in the power of networks, people express their best potential when surrounded by the right people and in the right environment.","About us":"linkedin","Solo team":"solo","Availability":"yes","Apply accelerator":"Yes","Notes":"0","Yes/No - Feedback":"NO/growth experience/had a tracktion and already have a product/ social app/ dont have strict technical skills/ open to a new customer ideas/ I feel he has interest in network, not in building"}},{"id":"rec4jC96BIAAdfK0f","createdTime":"2025-10-17T07:32:57.000Z","fields":{"First name":"Vivien","Last name":"Perrelle","Email":"vivienperrelle@gmail.com","Linkedln":"https://www.linkedin.com/in/vivien-perrelle","Whatsapp":"https://github.com/VivienP","Skills":"Product and design","Problem":"I’d love to achieve Content-Market fit using AI by automating campaigns and pinpointing the perfect sweet spot to effectively engage your audience.","⁠⁠First users":"Product and design","Solo team":"Solo","Availability":"Yes","Apply accelerator":"Yes","Notes":"0"}},{"id":"rec5gItqbZJXcKdp3","createdTime":"2025-10-17T07:32:57.000Z","fields":{"First name":"Amalai Rham","Last name":"Machunga","Email":"amachunga@gmail.com","Linkedln":"https://www.linkedin.com/in/amalai-machunga/","Whatsapp":"https://github.com/amachunga","Skills":"Python, GitHub, SQL, AWS","Problem":"AI-Powered EdTech platform focused on solving the problem of complex and overwhelming scholarship applications. According to Forbes, $100M+ in scholarship funds going unclaimed annually due to limited awareness, complex eligibility criteria, and cumbersome application processes.","⁠⁠First users":"Python, GitHub, SQL, AWS","Solo team":"Team","Availability":"Yes","Apply accelerator":"Yes","Notes":"0","Yes/No - Feedback":"?YES/ have an idea in edtech -scholarship search/ very early/ technical profile","Maxime Comments":"NO - 0 scholarship given to students in 10+ months of working
","Decision":"No"}},{"id":"rec5jgnkL7vsNTaUn","createdTime":"2025-10-17T07:32:57.000Z","fields":{"First name":"roberto","Last name":"arce","Email":"roberto_arce_@hotmail.com","Linkedln":"https://www.linkedin.com/in/robarce/","Whatsapp":"https://github.com/Robertoarce?tab=repositories","Skills":"Data scientist/ml engineer","Problem":"learning languages, by a  AI-powered app that helps you through translations, conversations with intelligent vocabulary management and spaced repetition flashcards","⁠⁠First users":"Data scientist/ml engineer","Solo team":"Team","Availability":"Yes","Apply accelerator":"I don't know","Notes":"ONBOARDED
","Yes/No - Feedback":"YES/building the app to learn languages/very early stage/vibe coder","Maxime Comments":"OK 6/10 - Smart guy but not a big founder mindset - even less consumer","Decision":"Yes"}},{"id":"rec6W9BUcIeppOkwN","createdTime":"2025-10-24T00:23:08.000Z","fields":{"First name":"Chirag","Last name":"Kankrecha","Email":"chirag.jain889@gmail.com","Linkedln":"https://www.linkedin.com/in/chiragkankrecha/","Whatsapp":"+33745376786","Skills":"I’m a technologist and founder with experience leading global technology initiatives across multiple countries, and currently working for loreal as the lead of their api platform (api.loreal.net). As a founder, I’ve built and operated a food-tech startup in India, giving me hands-on insight into the HoReCa and retail sectors.

Tech skills: Product Management, API Platforms, Food Tech, Automation, Cloud Integrations, and emerging expertise in AI applications.

Core skills: Team Leadership, Strategic Partnerships, Retail Operations, Brand Building, Data-Driven Decision Making, and Go-To-Market Strategy.","Problem":"While running my food tech brand, I realized how important personalization has become for modern consumers. Today, people rely heavily on Google Maps or generic review apps to decide where to eat or drink — but these platforms aren’t designed for personal taste, mood, or context.

